72,9,"s",66,"2017-05-20 11:28:06","2017-05-20 11:28:06",1,"ビジネス全般","6ヶ月〜11ヶ月","週5日以上","無給（交通費なし）",4,6,8,19,19,19,9,"【業務内容】 （前提：貧困層の女性たちにいぐさを使ってものづくりをするという仕事を提供することで、女性たちに安定した給与が入るようにしている。また、いぐさで作られた製品はカンボジアのシェムリアップ市内などで販売している。） ・HISなどを通じてカンボジア訪れている人たちに女性たちが働く場所を紹介するツアーガイド ・いぐさ製品を販売している店舗での売上改善 ・貧困層の女性たちの接客教育（英語・日本語教育も含む） 【割合】 ・ツアーガイド４０％ ・売り上げ改善２０％ ・接客教育４０％",NULL,"・準備力：あらゆるタスクで１２０％以上を求められるため、タスクを俯瞰し、与えらた課題以上のアウトプットを出すにはどうすればいいか考え、準備ができるようになった ・柔軟性：カンボジアは自分では変えることのできない環境の変化（停電など）が多いため、これらの変化に動揺することなく取るべき行動を取れるようになった","インターン生の受け入れには慣れており、かなり受け入れ体制は整っている。（ETICの一貫でインターンを実施しているからでもあると思う。）週１で上司から、時々には創業者からもフィードバックを受けることができた。",NULL,NULL,"・日本ではありえないことが頻発するため、日本で起こることには動じないぐらいの度胸がつく。 ・正規の社員の仕事量が多いため、余裕がない時があるが、周囲がキリキリした状態であるからこその人間性を高めることができる。 ・途上国で働くということがどのようなことかを余すことなく経験できる。大学卒業後途上国での就職を考えている人には、学生のうちにこのインターンを経験することで、キャリアの考えに広がりを持たすことができると思う。"
73,9,"s",67,"2017-05-20 11:28:11","2017-05-20 11:28:11",2,"ビジネス全般","1ヶ月未満","週5日以上","無給（交通費支給）",10,6,10,10,8,10,10,"・業務内容：スタートアップ企業なので様々な業務を任された。具体的には、再生可能エネルギーの提供先である自治体やアセットホルダーとの会議へ参加し議事録作成、バイオマスプラントのデータ分析、シンポジウムへの出席、バイオマスプラントへのチップ搬入作業や清掃まで幅広く行った。 ・割合： 議事録：20% 分析:60% 事務作業等:20%",NULL,"・分析力 プラントのデータ分析では実用的な分析スキルが身に着いた。特に私はバイオマスプラントにおいて最適なチップの水分量の算出を任され、膨大なデータのうちから何を分析すればそれを求められるのか、という仮説を社員と一緒に考えるところからの始まりだった。PDCAサイクルの回し方をこれで会得できた。 ・積極性 スタートアップなので様々な仕事があり、自分で積極的に新たな仕事に取り組む環境が整っていた。","・インターンの受け入れ実績も多数あるため、面倒見は特によい。上記の分析業務を行った際も社員さんに仮説についてのフィードバックを多く貰い、それにより最終的には正しい仮説を立てることができ結果を出せた。最終日には送別会も行ってもらった。",NULL,NULL,"・分析を仮説を立てるところから関わるという、ある種理系的な業務を体験することは非常に有意義である。これは社会人になってから求められるものであるが、文系の学生は特に大学の授業では経験できないことだからだ。 ・また再生可能エネルギー規制が強化されている今でも成長を続ける数少ないスタートアップの一つなので、そのビジネスモデルを中から学ぶことができることは大きなメリットである。"
74,8,"s",68,"2017-05-20 11:28:14","2017-05-20 11:28:14",3,"リサーチ、営業","6ヶ月〜11ヶ月","週3日〜4日","800円未満",6,8,8,10,10,10,8,"・カーボンクレジット業務(60%) 企業が再生エネルギーや省エネの導入によって削減したCO2に基づき創出された排出権（クレジット）。一方で、日々の企業活動（工場操業など）で排出されるCO2を先のクレジットを用いて帳消しにすることを望む企業もある。こうした企業に対して、目的や対象、納期、予算等をヒアリングしたうえで、適切な排出権を適正価格で案内し、販売している。顧客のために、そもそもCO2排出量の算定も行っている。 ・リサーチ業務(40%) 海外事業の調査。自社、あるいは他社が進出を検討している国や、そこでの事業可能性に関する調査を行う。海外出張に行くインターン生も少なからずいる。",NULL,"・PCスキル（Word,ExcelはもとよりPowerpointやIllustratorを恒常的に扱う） ・説明能力（インターンの同僚や上司（社員）と「報連相」や議論を行う中で、相手を納得させる思考の癖を身に付けられる） ・高度な対人折衝能力（日々の電話応対や来客応対、メールでのやり取りを通して「紳士/淑女的振る舞い」「アドリブ力」を磨ける。） ・管理能力（入社して2週間もすると、自分の案件を複数任される。「期日内のタスク完了」を絶対的な目標とした上で、その為にとるべき手段を常に考え、行動・修正する能力を磨ける。時には誰かに依頼することも重要な判断。）","・2か月に1度のフィードバック。 そこでは、普段の業務や社内の人間関係におけるパフォーマンスを基にした、自身の長所や改善点を事細かに教えてもらえる。自身に対する評価は、会社の社員全員から集めたコメントや評価を基づくので非常に説得力がある。昇給（減給）もこのフィードバックの際に伝えられる。 ・普段は「インターン教育係」「カーボンクレジット担当（取締役）」「財務、事業統括責任者」の3人の社員が普段の業務について、助言・監督をしてくれる。採用面接や2か月毎のフィードバックもこの3人が担当。 ・飲み会が多い。 飲み会では、2か月に1度のフィードバックとは毛色の異なる「ぶっちゃけた話」を様々伺える。普段の業務や将来のキャリア、はたまた色恋に関してまで、百戦錬磨の社員さん達に相談出来るので非常に有益。",NULL,NULL,"・この会社の社員は、かつて外資証券・PE・会計事務所・日系化学メーカー等で活躍してきた強者揃い。こうした「デキる社会人」の仕事に対する向き合い方を、身近でたっぷりと学べるのはとても幸せなことだと思う。 ・このインターンに参加する学生は皆、志が高く、良い意味で独特。こうした同期と半年間、切磋琢磨できるのは本当に貴重な経験。OBOGも皆さん優秀で、キャリア相談にも乗ってもらえる。 ・ぶっちゃけ時給換算すると500円前後。お金を稼ぐ！という目的だと、このインターンはミスマッチ。 しかし、「管理能力」「対人折衝能力」が培われる日々の業務や、日々挑戦できる環境、優秀な同期や上司、といった諸条件の下でのインターンは、あなたを一回りも二回りも成長させると確信している。"
75,6,"a",36,"2017-05-20 14:15:03","2017-05-20 14:15:03",4,"エンジニア、マーケティング、営業","6ヶ月〜11ヶ月","週5日以上","1200円〜1399円",10,8,10,10,10,10,10,"業務内容： ・メンタリング活動：ruby,html,css,ruby on rails を中心に受講生の疑問や質問に答えながらサポートする。(60%) ・イベント企画などの集客：TECH::CAMPは現在全国に14拠点あり、今後もさらに拡大していくため、自分が所属する拠点の運営全般を任されるため、その所属拠点の立地などを踏まえ、どういう方をターゲットにするかを考え、どうやって受講につなげるかまでを考え,提案し,実際に施策として落とし込み,実行する。(40%)",NULL,"・プログラミングスキル・・・インターン生として採用されると開発課題が与えられるため、必然的に技術力が上がる。 ・問題解決能力・・・メンタリング活動をしていく上で受講生の方の質問に対し、どういったことが原因で問題が起きているのかということを丁寧なヒアリングを通し見つけだし、解決のための最短ルートを考え、それを伝える癖がつく。 ・提案力/実行力・・・社員33名、インターン生約200名という環境で、自分が所属している拠点は現場を見ている自分らで回すので、上に提案したことはほとんど通り、自分が責任を持って実行することができる。","インターン生として働く前に研修が1ヶ月半程あり、その後メンター試験となる。その間にしっかりメンターとして働くための力をつけることができるのと、先輩メンターと仲良くなることができるので受け入れ体制は整っている。試験に合格しメンターになってからは開発課題が与えられ、それを進めていくうちにさらに力がつく。それも終えると自分の適正で自分がやりたい仕事を選ぶことができる。(例:会社のシステム開発、採用業務、マーケティング、広報、営業、VRメンター、PHPメンターなど)",NULL,NULL,"自分がインターンに参加したメリットはプログラミングの基礎的な力をつけることができたのと同時に、自分が興味のあるビジネスサイドの方も好きなだけできる。自由な分責任が伴い、上からの指示に従って仕事をするのではなく、現状をよりよくするためには何が必要で、お金、時間人材などのリソース的な部分を考えてそれは実現可能なのか、実行する価値はあるのかということを考えながら仕事に取り掛かることが仕事をする上での基本的な姿勢になっていることがこのインターンに参加するメリットです。"
76,7,"a",70,"2017-05-20 14:15:08","2017-05-20 14:15:08",1,"広報","6ヶ月〜11ヶ月","週3日〜4日","1000円〜1099円",10,10,10,10,8,10,10,"業務内容:広報 オウンドメディア運営 10% 社内理念浸透 10% 外部メディアアプローチ 80%",NULL," ・正しい敬語の使い方 ・ビジネスマナー ・広報に関する知識 ・採用に関する知識(採用広報だっただめ) ・他社の広報、記者とのリレーション ・周りのメンバーの巻き込み方","キュービックポケットというインターンのための制度パッケージがあるくらいインターンに注力している企業。 150人もインターン生がいるので、初期指導から教育フロー、裁量の大きさはどこよりもしっかりしていると思う。",NULL,NULL,"・働くリアルを学ぶことができた ・そのままインターンから新卒で入ったので、入社後のギャップがない ・新卒から大きな仕事を任せてくれる"
77,8,"d",71,"2017-05-20 14:15:18","2017-05-20 14:15:18",2,"秘書","6ヶ月〜11ヶ月","週3日〜4日","1000円〜1099円",6,4,6,6,6,8,4,"業務内容：主にクライアントの社長とのインタビュー予約の電話７０％、既存のクライアントのフォローアップのメールや電話２０％、事前の打ち合わせの通訳１０％。",NULL,"・ビジネス敬語>電話対応 ・通訳＞クライアントとの事前打ち合わせでインターン先の同僚との通訳 ・メール＞日本語の言い回し、書き方","そもそも友達の紹介で知ったインターンで海外の企業であり、全くない。 どちらかというと一旦やることを教えてもらったから終わりでバイトに近い感じがした",NULL,NULL,"一流企業の社長とインタビューをすることもできる（通訳で） また個人的に現在の職場で日本語の電話対応などの教育が特にないのでとても役立った"
78,7,"w",72,"2017-05-20 14:15:23","2017-05-20 14:15:23",3,"Web広告運用","1ヶ月〜2ヶ月","週1日〜2日","1000円〜1099円",10,10,8,6,8,8,6,"Web広告運用。クライアントがおり責任が重いため初めは運用は任せてもらえない。そのため、広告の入稿作業や検索広告の作成が主な業務となる。 入稿作業：30% レポート作成：30% テキスト広告作成：30% その他：10％	",NULL,"・Google Adwordsの扱い方 　Googleに広告出航する際に用いるツールの扱い方を学べる。レポート抽出とその見方もわかる。 ・Yahoo SS / GDNの扱い方 　Yahooの検索エンジン等に出稿するためのツールの扱い方を学べる。レポート抽出と見方もわかる。 ・Excelのfunction 　エクセルの機能に詳しくなり、使いこなせるようになる他、ショートカットも覚えられて日常のエクセル捌きが上手くなる。 ・ビジネスマナー 　ビジネスメールの書き方など基本的なこともしっかり教えてくれる","教育体制は非常に良いものとなっています。 ビジネスマナーや情報取り扱いに関する研修がある。 基本的な研修が終わったあとは、各部のチームに配属される。そこでも担当がついてくれてわからないことがあれば、手厚く教えてくれる。",NULL,NULL,"WEBに関することやWEBマーケティング、WEB広告に関する業界や業務の知識と経験を積むことができる。 また、福利厚生がしっかりしているため、楽しみながら就労することができる。"
79,8,"a",69,"2017-05-20 14:26:11","2017-05-20 14:26:11",4,"セールス、マーケティング、IT","6ヶ月〜11ヶ月","週3日〜4日","900円〜999円",10,10,10,10,10,10,10," ・業務内容 セールスコンサルタントのプロスペクティング、レポート　90% ロングタームレポート10%","裁量権はある程度与えてくれたと思う。いろいろな仕事を任せてもらえることもでき、多く学ぶことができる。","マネジメントスキル エクセル パワーポイント コミュニケーションスキル prospecting skills","メンターがつき、毎日その日の仕事のできをフィードバックしてくれる。 社員全員の面倒見がとても良く、わからないこともしっかり教えてくれる。","オフィス環境は非常に良い。皆明るく元気だが、自分の仕事には集中している。自分にとっても非常に働きやすい環境であった。","期待以上の内容でとても満足している。いろいろな仕事やプロジェクトにしっかり関わることができるので学べることがたくさんある。	","オフィス全員と話せる機会がいっぱいあり、仕事面でもプライベート面でも中を深めることができた。 将来の悩みや考えも聞いてくれサポートしてくれる。"
80,10,"a",73,"2017-05-20 14:32:00","2017-05-20 14:32:00",1,"webマーケティング、経営企画室、オムニチャネルマーケティング","1年以上2年未満","週3日〜4日","900円〜999円",10,8,8,10,8,10,8,"業務内容:オムニチャネルのファッションテック「LaFabric」のマーケティングおよび経営企画室での事業戦略策定、業務改善に務めた。 web/オムニチャネルマーケティング:20% SNS、メルマガの運用によるリターゲティングや売上施策の立案、実行、効果測定等。 事業戦略策定 40% 会社のビジョンから各部門のあるべき姿を策定し、中長期的事業戦略を策定。 サプライチェーン改善 40% 注文から発注、ロジスティックから店舗業務までムダ、ムラ、むりを突き止め、改善し社内共通マニュアルを作成。 おすすめしたいのは、これらの業務を自分が取り組みたいものにウエイトを乗せて取り組めること。私はコンサル内定だったため、マーケティングから徐々に経営企画や業務改善等の仕事のウエイトを増やした。インターン生の意見を尊重し、本当に会社の歯車として起用してくれるため、やりがいと責任が大きい。インターンとは名ばかりのアルバイトをさせられる会社もあるが、ライフスタイルデザインでのインターンは、本当の意味でためになることを学ばせてくれる環境なので、自分から手を挙げて好奇心からチャレンジできる人にはぜひおすすめしたい。","経営企画室で人事アシスタントをしている際、求人サイトへの出稿80万円を自ら契約するチャンスをいただいた。それ以外の場合でも、基本的に自らやりたい業務を名乗り出て、働くという姿勢が根付く環境。自分でやりたいと言ったからには責任を持ってやりきるという仕事をするに当たって最も重要な自主性を磨いてくれる環境。","・仮説思考と論点思考 何かを生む仕事を、的確に早くこなすために絶対に必要な考え方。 ・エクセル中級までのスキル 準応用な関数を用いながら、業務データを100×100セル程度で容易に回すことができるようになる。 ・仕事力 仕事とは何か、何を気をつければいいかといった頭でっかちになる前に必要なことを学ぶことができる。ただ作業ができる＝働けるということではないことを痛感させられた。","インターン生には1人メンターがつき、業務を通して自分が何をできるようになりたいか等を最低でも月1でフィードバックを受けることができる。社内も風通しがよく、目の前の業務に関しても考え方から作業の仕方まで丁寧に研修いただける。インターン生を、本当の一戦力として迎え入れてくれる整理と体制がある。","ファッションテックということもあり社員も皆平均年齢が若く、活気溢れる会社。はたらくことを楽しむという会社のビジョンをまさに体現しているような雰囲気だった。","コンサルに必要なスキルを身につけること。ギャップは特になかった。 コンサルとしてはもちろん、どんな職種で働くにしても不可欠なスキルを学ぶことができた。","・仲間ができる。 同じインターン生、お世話になった社員との縁は思ったより濃い。社会人になってからも改めて話すことで学びと刺激をもらえる。 ・社会人のスタートダッシュがびっくりするほど楽になる ここで学べたことは、まさに企業の縮図そのもの。ここまですんなりスタートダッシュができるなんて、と驚くはず。 ・就職活動に自信が出る イメージや雰囲気でしか仕事を理解していない場合と、異業種であっても『仕事』を理解した場合では、言えることとや考え方が大きく異なる。実際の仕事をイメージして語ることができるようになる。"
81,10,"s",74,"2017-05-20 14:32:06","2017-05-20 14:32:06",2,"営業","6ヶ月〜11ヶ月","週3日〜4日","1000円〜1099円",10,4,8,8,6,8,7,"外国人向け求人サイトの求人情報獲得のための営業活動100%。内訳、テレアポ20%。営業商談50%。準備、報告30%","社員同等のものであった。入社3日で営業マネージャーになり、ほかの営業メンバーを束ねる存在になった。また、商談では大企業の営業マンに対して会社説明をしたり、価格面の交渉をしたり、と普通の会社の一営業マンとしての活躍が期待された。","英語力。(会社に外国人が多いから) 身近に社長がいるので、そこから経営の力も吸収できる。 様々なことに挑戦する経験値","受け入れ態勢は整っていない。成長中の企業であるからこそ、新人教育に手が回らないので、十分な説明は受けられない。しかし、やってみてそこからトライアンドエラーをして、少しずつ軌道修正をしてくれる教育環境である。","オフィスでは、オンとオフの切り替え、また、様々なことに挑戦させてくれる環境がある。外国人が多々ある環境でもあり、英語でのコミュニケーションが頻発するが、日本人は皆で英語を頑張ろうという雰囲気。","友人の紹介ではじめた。もっと内勤やオフィスワークが多いと思ったが、いい意味で様々なことに挑戦させてもらえた。","大学自体とは違う、ビジネスに本気な仲間がたくさんできた。また、英語力という面で非常にモチベーションがあがり、なによりも、社長のおかげで何か新しいことをやってみる力はついた。"
82,8,"asa",18,"2017-05-20 14:32:10","2017-05-20 14:32:10",3,"秘書","1年以上2年未満","週1日〜2日","無給（交通費支給）",10,8,8,8,8,8,8,"事務仕事(30%)ファイル整理、名刺整理、国会・委員会にて情報収集 イベント補佐(10%)後援会などの集まりの際に運営をサポート リサーチ(60%)事務所にはよりますが、仕事がない時には自由に資料を見ていていいよと言われるケースが多い。政策の作成過程や、きになる分野について学習できる時間が多く確保できる","何かの決定に関わるという経験はできない。国のレベルであることが大きいだろう。このインターンはどちらかというと、公共政策や政治に興味があり、純粋に学びたい”雰囲気を感じて見たい”人向けである。","政治的なセンスが身につくと考える。ここでいう政治的センスとは、政治家として、様々な地位や職業の人とどのように接していく必要があるか見極めることである。","これは完全に事務所により異なる。実際に生徒に課題を与える事務所もあるよう。対して、私が研修した事務所のように自由に学ばせてくれる事務所もあります。",NULL,NULL,NULL
83,8,"a",76,"2017-05-20 14:32:20","2017-05-20 14:32:20",4,"営業、事務","1ヶ月〜2ヶ月","週1日〜2日","無給（交通費支給）",8,8,8,8,6,8,6,"営業60% 各現場での営業の見学 研修20% 工場、研究所様々な所で勉強させて頂いた。 事務20% レポートや意見出しなどを行なった","上層部の方々と意見を交わすことが多かった。まとめた文書はチーム全員に配られ、これからの指標として扱われた。リーダーのみの会議にも出させて頂き、意見出しや決定に携わった。","・度胸 市長や頭取と話すことが多かった。 メンタルが鍛えられた。 ・社会人の基本 細かなことの基本はしっかりと教えられた ・営業 社長、営業トップの方々の営業を目の前で拝見し、勉強させて頂いた。","特別プログラムだったので教育体制はあまりなかった。 若手と上層部どちらとも関われる良い機会だった。 研修プログラムは特になく、場に応じた動きが求められた。 社員とは特定の人と関わることが多く、全員とは話せなかった",NULL,NULL,NULL
