id,rate,"review",product_id,"created_at","updated_at",user_id,"occupation","length","often","hourly_wage",rate_flexibility,rate_wage,rate_future,rate_growth,rate_social,rate_value,rate_reccommendation,"review_job","review_authority","review_skills","review_training","review_environment","review_expectation","review_merit"
24,5,"a",23,"2017-05-17 15:22:06","2017-05-17 15:22:06",1,"経営企画、プロモーション、商品開発、人事、教室運営新規事業","2年以上","週3日〜4日","1400円以上",10,8,10,10,10,10,10,"【業務内容】 ・教務(教科内容を教えたり、生徒の人生に向き合う面談など) ・HRM(募集・採用・配置・育成・評価など) ・プロモーション(新聞折り込みや駅の看板などを検討) ・経営企画(経営戦略の立案、校舎展開や事業買収まで) ・商品開発(留学プログラムの作成や、イベント企画、担任制度の開発・サーベイの開発、数学テキストの開発など) ・新規事業(新規事業の立ち上げ) 【割合】 インターンは70名程度いるので、かなり人によります。 教務だけに取り組むインターン生もいれば、 経営者に近しいポジションで仕事するインターン生もいます。","入社当初は与えられる仕事は主に教務であるが、パフォーマンスを出して、信頼を獲得すると自分の望む仕事を出来るようになる。最終的には社員とほぼ同等の裁量を持って働くことも可能である。","どんな場所でも普遍的に必要な能力(ポータブルスキル)が身に付いた。 ・対課題力 課題を発見し、問題解決する手法と計画を考え、周囲を巻き込んでプロジェクトを確動性を持って推進するスキル。 ・対自分力 自分の性格特質的な弱み →必要以上に悩んでしまう。忍耐強く人の話を聞けない。合理を優先し情理を汲み取れない。などを改善できた。 ・対人力 自分の考えを上手く構築し、説得力を持って話せる力。リーダーシップを持ってチームを巻き込む力。メンバーのモチベーションコントロール。など","入社してからレベルごとに数多の研修を受けられる。 グループの親会社が組織コンサルなので、研修や教育制度はかなり充実している。基本的に入社すぐはメンターが1人以上いて、週1のランチは会社からの補助が出る。社員とは普段のコミュニケーションの加え、3か月に1回面談形式で振り返りと目標設定を個々人の人生に寄りそうような形で一緒に考えてもらえる。","・渋谷/自由が丘/下北沢の駅から5分以内の好アクセスな場所にオフィスがあり、専門のデザイナーが設計したのでお洒落。","期待：教育系の企業で、経営などビジネスに携われる、給料が良かったので志望した。 ギャップ：授業の給料は高いので、ガッツリ働けばその辺の新卒くらいは稼げる人もいる。一方で、企画の給料が一律なので、業務内容により一概に経年傾斜方式ではない。","特異なスキルなどを必要としない限りはほぼすべての「仕事力」が身に着けられる。東証一部上場企業の役員と日常的に仕事をし、ご飯に行けるのは人生にとっても非常に大きな刺激と影響を与えてもらえる。"
25,6,"a",24,"2017-05-17 15:22:12","2017-05-17 15:22:12",2,"旅行企画","3ヶ月〜5ヶ月","週1日〜2日","無給（交通費支給）",8,8,4,8,8,10,7,"旅行企画(サイト上に旅行企画を投稿し、自ら代表者として実行):75% 事業立案(3ヶ月間に2回ほどビジネスコンテストがあり、各グループに分かれて事業計画):25%","旅行企画は各個人に任されているので、自分の好きな場所や日時を決めて集客することが出来る。個人作業が中心となるので、かなり裁量があると言ってよい。","・マネジメントスキル 企画に参加する人はほとんどが社会人であるため、ツアーコンダクターとして年上の方々をまとめる必要がある。 ・マーケティングスキル どのような旅行企画が集客として上手くいくか考えながら計画するので、戦略方法が自然に身につくと思う。

","インターンメンバーは各グループに分かれてそれぞれにメンターがつくので、かなり面倒が良いと思う。自分次第ではかなりの社員の方々と関われると感じる。","一般的なベンチャー企業のオフィスで、開放感があると思う。雰囲気も和気あいあいとしており、風通しが良いと感じる。","もともと旅行が好きで、当時は無給ではあるものの交通費が支給されたので、好きな観光地に無料で行くことができた。旅行好きには非常に楽しくやりがいのあるインターンになると思う。","旅行好きが多いので、旅行の話で盛り上がることが多い。また、旅行企画では、たくさんの社会人と交流する機会があるので、かなり視野が広がると思う。"
26,7,"a",25,"2017-05-17 15:22:16","2017-05-17 15:22:16",3,"コンサル、医療観光","1年以上2年未満","週1日未満","800円未満",10,5,8,8,8,10,10,"エクセル使って情報収集する80%,医療通訳20%(中国語使用) それ以外はオフィス雑務、自分たちで事業作ってみたりした","医療通訳においてはお客様の健診を1日通して担当する。インターン生が立ち上げる事業については裁量権大きい

","エクセル知識:関数など運用してきれいなエクセルができるようになります。 医療通訳の経験 オフィス雑務","面倒は非常に良く見てくれました。インターンに関係ない就活のアドバイスや職場のアドバイスが良く頂けました。","落ち着いて働く環境が整っており、ネット環境や備品もバッチリです。オフィスの雰囲気もすごく良かったです。","アクセンチュアから独立した方がほどんとで、コンサル業界や仕事については色々聞ける。ギャップは特になかったです","希望してた会社に内定頂いたことと最高の先輩に出会えたこと。前もって仕事についてイメージを掴め、コツを見つけたこと。"
27,8,"a",26,"2017-05-17 15:22:32","2017-05-17 15:22:32",4,"Finance","3ヶ月〜5ヶ月","週3日〜4日","1000円〜1099円",8,8,8,5,8,8,8,"50% - Data search (Bloomberg, Internet) 30% - Organize Exel data 20% - Attend companies' financial report meetings","I wasn't given much authority over the work. My main job was to search and organize the data of my seniors.","Bloomberg usability - I learned how to use Bloomberg machines overall","There was no systematic training for interns. It was a small company and I was the only intern. I was given a manual for interns, and had to learn by myself most of the times.","Because it was a sell-side research firm, individuality was very strong in the office. Office was quiet the most of the times, and there was rare interaction between workers.","Expectation: learn how financial company runs, see how sell-side institutions work, feel the atmosphere of research firms Reality: I was able to experience how financial companies run, and see what sell-side analysts do","Doing this intern, you get to understand how sell-side research firms operates. You get to understand what data is important, how to find those data, how these firms publish their reports."
28,9,"a",27,"2017-05-17 15:22:36","2017-05-17 15:22:36",1,"AD (番組製作補助業務)","2年以上","週1日〜2日","1000円〜1099円",4,8,5,5,8,8,4,"業務形態は企業バイト。ニュース番組でのAD業務ー100％。ディレクターの補助やその他雑用など製作に関わる庶務一般。特殊な技能は必要ないが、社会人としての最低限のマナーや肉体的、精神的なタフさが求められる。","あくまでディレクター（社員）の補佐が主な業務なので、最良や権限はほぼ与えられていない。ただ、番組が製作されていく過程や具体的な作業を知ることができ、将来メディア関係の仕事につきたいという人にとってはとても勉強になる。社員との信頼関係が出来上がるまでは、なかなか仕事を任せてもらえないが、地道に頑張ることで仕事が増える。","＜マネジメントスキル＞インターン生の採用、教育に携わる。マニュアルがある仕事ではなく、自ら仕事を見つけこなしていく姿勢が評価されるので、そういった積極的なマインドを後輩に伝えていくことも大切。 ＜責任感＞４年契約での雇用であり、また何より業務が直接放送に影響を与えかねない仕事なので、仕事に対する責任感を養うことができる。","教育は基本的に先輩インターン生から受ける。社員はあまりインターン生に興味はない。特に男子は、1、２年かけて地道に少しずつ信頼関係を築き、ようやく相手にしてもらえる。","職場自体は明るい。前述の通り、社員と信頼関係を築くのに時間がかかるが、一度一人前として認識してもらえると、製作の裏話を聞かせてもらえたりや飲み会などにも呼んでもらえる。","マスコミ業界に興味があり、製作の裏側や過程を知る、あるいはそれに参加するという期待は十分に満たせれた。一方、裏側を知りすぎてしまったことでマスメディア全般への信頼が失われた。","マスコミの職場で、他の社員と同じように仕事ができるというだけで学生にとってはメリットになりうる。テレビ局の社員の発想力、柔軟性、手際のよさを間近でみることができる。また、大人とコミュニケーションをとることが当たり前のように必要になってくるので、その経験は学内外での活動や就職活動にもいかせるだろう。"
29,10,"a",28,"2017-05-17 15:22:40","2017-05-17 15:22:40",2,"国際機関","3ヶ月〜5ヶ月","週5日以上","無給（交通費なし）",4,5,8,8,8,10,5,"イベントやキャンペーンなどの企画と実施のサポート（20%）、所長・職員の補佐（20%）、SNSでの配信サポート（20%）、新聞クリッピング（15%）、翻訳（20%）、国連を訪問する中高生に対するブリーフィング（5%）","ある程度の裁量権が与えられた。イベント運営の際や国連本部が新しい企画を行う際は、インターンとして意見やアイディアを求められ、それが採用されることも多かった。ブログ記事なども、インターンが書いたものをもとに修正が入れられた。","・記事作成スキル：広報用の記事を執筆する際に文言などで注意する点を丁寧に指導して頂いた。 ・翻訳：重要な文章や技術的な文章を翻訳する機会が多くあった。 ・協働力：常に3~6名のインターン生と共に作業をするため、チームワークを意識して仕事に取り組んだ。","常にインターン生を受け入れるため、新入生のためのマニュアルや受け入れ体制は整っている。職員が指導するのではなく、インターン生同士が指導し合うことになっていたので、教える側は業務を説明できるようにならなければならず、より深く業務について理解することが出来た。 職員よりインターン生が多い時もあり、インターン生がオフィスを盛り上げているという印象だった。","オフィスの環境は明るくオープンであったが、職員同士の連携があまり取れていないように見受けられた。インターン生同士は仲が良く、非常に楽しい労働環境であった。","地球規模課題の解決に取り組みたく、将来は国際機関で働きたいと思い、本インターンシップを志望した。インターン期間中は、ちょうど「持続可能な開発プログラム」が始動した時であり、地球環境問題関係のイベントや記事の執筆にあたることが出来たため、満足であった。しかし、東京勤務だったこともあり、事が起きている「現場」の緊迫感をいまいち感じることが出来ず、その点において、期待していたものとのギャップを感じた。","将来、国際的な仕事や国際貢献をしたいと考えている人にとっては、自分が本当に携わりたい仕事なのかを見極めることができる良い機会だと思う。本インターンシップを通じて、自分はどういった立場で社会に貢献したいのかがより明確になると考える。"
30,8,"a
",29,"2017-05-20 05:14:04","2017-05-20 05:14:04",3,"コンサルタントサービス","1年以上2年未満","週3日〜4日","1100円〜1199円",8,10,10,10,10,10,10,"■仕事内容 SPEEDAをご利用いただいているお客様の窓口を担っています。SPEEDA上からからきたお客様からのお問い合わせを受け、一人一人のニーズにお応えすることがメイン業務です。具体的には、SPEEDAの使い方の説明や、エクセルでのデータ作成、リサーチを行います。 インターン生の希望や適正に沿って、業務を割り振ります。 ・電話、メールでの対応 ・データ作成 ・リサーチ ・業界レポートのメンテナンス 元々はリサーチがメインでしたが、インターン生の中では古株なので、現在はチームのマネジメントに力を入れています。 ・電話、メールでの対応: 30% ・データ作成: 0% ・リサーチ: 20% ・業界レポートのメンテナンス: 10% ・チームのマネジメント: 40%","社員の方と同程度の裁量権が与えられます。","・会計、ファイナンスの知識 ・あらゆる業界の知識 ・リサーチスキル ・エクセルスキル ・マネジメントスキル ・ビジネスコミュニケーションスキル","最初は、業務に慣れているインターン生にフォローされながら、トレーニングプログラムを行います。その後、だんだんとお客様からの依頼に対応していきます。毎度、社員からのフィードバックがあるため、毎日が学びの場です。"," ユーザベースには「7つのルール」という大切にしているバリューがあります。これがカルチャーの根底になっていると感じます。 ＜7つのルール＞ 1 自由主義で行こう 2 創造性がなければ意味がない 3 ユーザーの理想から始める 4 スピードで驚かす 5 迷ったら挑戦する道を選ぶ 6 渦中の友を助ける 7 異能は才能","入社前はユーザベースをただのベンチャー企業の1つとして捉えていました。大手企業を中心に就職活動は行う予定だったので、一度ベンチャー企業がどんなものなのかを一度味わいたいと思っていました。実際入社してみたら、SPEEDAもNewsPicksも地に足の付いているプロダクトなので、思っていたよりも軽い感じではありませんでした。それは面白いギャップだったです。","・自分が作成/提案したアウトプットに対して、実際にお客様がどう評価するのか、どう反応するのかが分かる。そのため、自分の能力が客観的に評価される。一方、短期インターンでは、提案して終わるため、それができない（あっても社内からのフィードバックのみ） ・多種多様な業界のお客様に提案できる。投資銀行、証券会社、コンサルティングファームをはじめとするプロフェッショナルファームや、事業会社の経営企画部や営業部などのお客様から様々な内容のお問い合わせがくるため、毎日が新鮮です。また、お客様の仕事に対する理解もできます。 ・社員は、多様な業界の出身者が集っています。・過去インターン生の内定先が良い。 "
31,7,"a",30,"2017-05-20 05:14:15","2017-05-20 05:14:15",4,"ビジネス","6ヶ月〜11ヶ月","週3日〜4日","900円〜999円",5,5,8,10,5,8,9,"・労務管理30％、外部委託業務（物流・定期キャンペーン等）40％、法人資料制作・翻訳10％、採用業務・運営20％","裁量としては関わっていた各部署の社員のアシスタントなので、あまりなかった。社員の作成した資料や社内システム管理方法に意見をいうことがあったくらい。","・社会人としてのマインドセット ・社外・社内資料作成スキル ・ビジネスフローの作成スキル ・効率的な会議の進め方 ・多部署とのコミュニケーションスキル ・ロジカル思考 ・データ活用方法 ・スピード感のある仕事の進め方","直属の上司となった社員さんは複数いて、それぞれ要求されているものは違うものの、一人一人が真摯に私と向き合ってくれた。大手民間企業出身の方々ばかりだったのでフォローアップやフィードバックも適切で、社会人として必要なマインドセットを叩き込んでくれた。","労働環境は、ザ・ハードワークで熱い。本気で会社一丸となって、ヘルスケアで世界を変えようとしているので、社員もそのビジョンと真剣に向き合っている人ばかり。むしろ、それについていけないと合わないかもしれないが、バリバリなスタートアップの労働環境を味わえ、スピード感もあって楽しい。","インターン自体、社会に出る前に絶対経験しておきたいと思い、かつ将来的にヘルスケアの分野にいきたいと思っていたので、FiNCの理念に賛同し、ジョインした。最初の2ヶ月は、自分が本当に携わりたいと思っていた実際のビジネスの現場に触れることができず、モヤモヤが募っていた。正直雑用ばかりだと感じ、自分のバリューを見出せなかった。ただ、社員さんを気軽にランチに誘えるような空間だったので、希望部署の社員さんをランチに自ら誘い、思いを伝えた。そこからは、法人向けビジネスに特化したチームに入れてもらえ、希望の仕事ができた。","社員だけでなく関わっている学生も皆非常に優秀なので、自分の志気が高まる。ビジネスのみならず、栄養士やトレーナーの卵の学生とも触れることができ、様々なバックグラウンドの人と仕事をする経験が得られる。外部の人を招いた講演会や勉強会も頻繁に行われ、インプットの場としても最適。とにかく社長が優秀で熱い人なので、この人にだったらついていきたいと思えるような人物の元、モチベーションを保ちながら働ける。"
