id,rate,"review",product_id,"created_at","updated_at",user_id,"occupation","length","often","hourly_wage",rate_flexibility,rate_wage,rate_future,rate_growth,rate_social,rate_value,rate_reccommendation,"review_job","review_authority","review_skills","review_training","review_environment","review_expectation","review_merit"
39,7,"a",38,"2017-05-20 05:59:21","2017-05-20 05:59:21",4,"コンテンツ編集、カスタマーサポート","1年以上2年未満","週1日〜2日","800円未満",10,8,10,10,10,10,10,"自社サービス、KitchHikeのメディアコンテンツの編集、PR,福利厚生の賄い作り、イベントに参加、体験談執筆など。 また、サービス利用者のサポート コンテンツ編集60 サポート20 その他内容合計で20","先輩スタッフのアドバイスやフィードバック、指示のもと業務に当たっていた。 なので、目指す方向性に迷いはなかった。 しかし0からすべて決められているわけではなく、 自己の意見を求められるし、主体性を持って業務に向き合えば向き合うほど自身の成長に繋がる環境があった。","★webマガジン編集-word pressや画像の基本的な編集、自己満ではなく、人に読ませるための記事作りのヒント ★20人前の食事を1,5h以内で作り上げる段取り力、自炊力 ★コミュニケーション能力(対面、書面)","お昼ご飯は基本、みんなで食卓を囲んで食べるので、自分とは違うチームに所属してる人とも仲良くなれるし、チームの枠を越えてひとつのサービスを作り上げている感覚を常に持つことができる。 インターン生それぞれに合った仕事を割り振られるので、他人と比較したりするよりかは、自分の強みを伸ばすことに集中できる。 また、フォローもしっかりしているので、業務上困ったことがあっても心置きなく相談できる。","オフィスの雰囲気は明るく、みな前向きでハングリー。 一人一人の個性がしっかりしているが、対立することは無い。 本当に仲がいい。 働きやすい。 就活、バイト、インターン、学業、プライベートの両立が可能","もともと、インターンとして関わるつもりはなく、ただ人とサービスが好きで関わっていただけだった。 気がつけばそれがインターンになっていた。ただひたすら居心地がよくて、刺激的で、楽しかった。","普段大学では会えない人たちと会える 食生活、生活そのもののクオリティーが高まる 専門的な/自分の適正に合った業務ができ、スキルを磨ける インターンを終えても繋がりたいと思えるし、繋がることのできる人、サービス、会社であること"
40,8,"a",39,"2017-05-20 05:59:27","2017-05-20 05:59:27",1,"企画","1年以上2年未満","週3日〜4日","900円〜999円",10,5,4,8,4,5,3,"・業務内容:オウンドメディアの運営。記事発注から記事テーマの作成、seo対策、生産管理、エンジニアディレクション等、全般。 記事テーマ作成・50%、他社メディアのリサーチ・10%、資料作成・10%、エンジニア・デザイナーコミュニケーション・10%、その他。","基本的にインターン生の中ではリーダーのポジションを任されており、お金に関すること以外は一応決めてよかった。（とはいえ社員さんの決済・確認は行う）エンジニアとのコミュニケーションは完全に任されていた。一時期は記事生産体制の管理も他のインターン生とともに行なっていた。","・メディアというビジネスモデル:運営手法や、収支、アドネットワークの仕組み、戦略。 ・ロジカルシンキング・社員さんとミーティングでディスカッションしながら戦略について議論できるので磨かれる。 ・Pcスキル:スプレッドシートのスキルが1番。あとは自然にタイピングやリサーチスキルも。","受け入れ体制があまり整ってない。また社員さんたちも自分たちの業務で手一杯なので常に社員さんに助けてもらえるというわけではなく、基本はインターン主体。なので、伸びる人は伸びるがそうではない人も実際いる。","オフィスは活気のあるベンチャーという感じ。主体的に残業してる社員さんが多そうという雰囲気。 どこでも同じだと思うがインターンは少し肩身がせまい。","期待:ビジネスやit企業について理解できる。 ギャップ:itと一口に言ってもスモールビジネスから様々だと感じた。","学生だが結果を出すべき存在として扱ってくれることであらゆることに対してシビアになれる。また情報感度が高くなった。優秀な社員さんがキャリアも含めて相談に乗ってくれたり、アドバイスをくれる"
41,9,"a",40,"2017-05-20 05:59:32","2017-05-20 05:59:32",2,"広報","3ヶ月〜5ヶ月","週1日〜2日","無給（交通費なし）",10,5,10,10,8,10,10,"国内担当と海外担当があり、私は国内を担当していた。海外は東南アジアの途上国に半年〜１年間ほどの期間渡航し、そこで映像授業と教育をかけ合わせたアクションを起こすというもの。国によっては現地の企業や教育省とコラボして事業を進めていくこともある。国内は、その海外でインターンをしている学生の活動を日本そして世界に発信していく役割。彼らから記事を集めたり、途上国のイメージをポジティブに変える記事を書いたり、ミーティングでは議事録を担当したりウェブマーケティングの結果報告をしていた。(30％)Facebookでは毎日夜８時に記事や活動やイベント告知をしたり、クラウドファンディングの運営などを発信した（70％）。","国内担当の裁量は、海外担当や社員の方の裁量に比べて小さいものであったが、Facebookの毎日の発信は私にすべて任されていた。イベント作成や、クラウドファンディングの件は、社員の方と一緒に協力してやった。","・イベント作成：イベントをやる際に必要なことを学べた。人を集めるところから、場所のとり方、ウェブ上での拡散の仕方、など。 ・データまとめ：ウェブマーケティングのデータ化。エクセルやワードを以前よりも使えるようになった。 ・どうやったら人の心を動かせるのか、共感を生み出せるか、どれだけこの団体のやっている活動を広められるか、どのような方法がベストなのか、自分の頭で考える機会にあふれていた。これはクラウドファンディングを成功させる上でもこれから運営をまわしていく上でも、かなり大事なスキルになってくる。","社員の方と一緒に仕事できる。小さなオフィスでアットホームな雰囲気なので、分からないことがあればすぐ質問できる上に、海外にいる人ともSkypeでミーティングをしたりと柔軟だ。メンターはいなかったが、先輩が丁寧に引き継いでくれ、引き継いだ後もサポートしてくれた。社員の方とご飯に行って、これからの運営を話したり、夢について話したり、ざっくばらんに話せる素敵な社員さんしかいない。国内は研修はないが、海外担当は数泊の研修がある。かなり濃い。","小さくて居心地がよいオフィス。アットホーム。時間はある程度決まっているが、そのあとオフィスで自分のやりたいことややり残した仕事をやってもよい。","期待：私は海外担当希望だったが、留学の関係もあり国内担当になった。e-Educationの理念に胸を打たれて、ずっと関わってみたいと思っていた団体だったので、本当にわくわくしていた。実際インターン生として入ってお手伝いさせてもらい、かなり自分の力不足を感じた。だが社員の方、OGOBの方、同期とのつながりがとても大きくて、仕事のやりかただけではなく、NPOを仕事にしていく、好きなことを仕事にしていく生き方を学んだ。","とにかくe-Educationのメンバーはアツい。夢を持っていて、課題意識があって、自分の手で解決しようとしている。社員の方も、かなりの大企業から転職してきた方も多く、ひとつの組織をどう動かしていくか、エネルギーをどう作り出していくか、e-Educationなりに社会をどうよくできるか、を考えさせられる。得られることは無限大。"
42,6,"a",41,"2017-05-20 05:59:36","2017-05-20 05:59:36",3,"Marketing","1ヶ月〜2ヶ月","週5日以上","1200円〜1399円",5,10,10,10,8,10,10,"業務内容: 現在ビジネス上にある課題に沿ったプロジェクトを与えられ、最終日に社長含めマネジメントチームにプレゼンをします。 ミーティング40% 企画30% プレゼンづくり20% プレゼン10%
","実際にチームに入って働くので、社員と同じ裁量権を与えられています。上にも書きましたが、最終日にはマネジメントチームにプレゼンをしますので、影響を与えることができるポジションにつけてくれます。","マーケティングスキル:たばこ産業の中で、どのようにマーケティングするのが良いのか、またマーケティングするためにどのような背景があるのか、すべてを1から学ぶことができる。 プレゼンスキル:最終日にプレゼンをする際に何度も確認、練習し、完璧な状態でプレゼンをするので、力がつきます。","インターン中はコーチ1人、バディー１人が付くので、インターン生1人につき２人の社員がつきます。 更に、チームメンバーもいるのでサポート体制はとても厚いと思います。 研修でフィリピンに行くこともあります。","オフィスはとてもオープンで男女関係なく働きやすいと思います。社員の人もなんでも質問に答えてくれるし、たくさんアドバイスをいただけます。 大企業にもかかわらず、社長やマネジメントチームとの距離も近く、過ごしやすいです。","自分はそもそも「働く」という事がどういう事なのかを知らなかったので、働くという事がよくわかりました。 ギャップと言っても良い意味でですが、自分は今までたばこに良いイメージはなく、敬遠する側だったのですが、会社がビジョンを持って動いているという事に気づく事ができました。","大企業で実際にチームに入って働く経験ができるインターンはなかなかないと思うので、まずその経験はとても大きいと思います。更に同期はハイレベルでとても刺激になります。 インターンが終わり、良い成績を残すと内定がもらえるので、そこも魅力の１つです。"
43,7,"a",42,"2017-05-20 05:59:40","2017-05-20 05:59:40",4,"リサーチ","6ヶ月〜11ヶ月","週1日〜2日","1000円〜1099円",10,8,5,8,8,8,8,"・業務内容：アーキタイプ株式会社は、ある大手通信企業からコンサルティング業務を請け負っており、月に一度のミーティングにおいて世界の最新のIT業界の動向をプレゼンしている。インターン生はそこで使われる資料を作成する。毎回設定されるテーマ(例えばEC、自動運転など)に沿ってリサーチし、パワーポイントにまとめる。・割合：資料作成90%、その他雑務(お客様対応など)10%

","裁量権はあまり与えられていない。主にインターン生は、指示された項目について各自がウェブで検索し、資料をまとめる。","・リサーチスキル：特定のスタートアップ企業やビジネスに関連する記事を収集し、ビジネスモデルを理解する能力が身に付く。・英語力：海外のウェブサイトを参考に資料をまとめることが多いため、素早く英文を読み内容を把握する能力が身に付く。","基本的にインターン生と社員との仕事場は分かれており、疑問があったらインターン担当の社員のところへ質問に行くといったスタイル。ただお昼休みは社員とともに外へ出掛けることが多く、IT業界についての専門的な話を聞くことができる。","洒落たBGMが流れており、内装もカフェのようでセンスがあって非常にリラックスして働ける。リラックスしすぎたインターン生が勤務中に寝てしまい、注意されたことがあった程である。","期待：ベンチャーキャピタルとコンサルティングの業務に就きたいと思って志望した。ギャップ：ベンチャーキャピタルの業務に直接関わることはできなかった。また、予想以上に個人作業が多かった。","業務を通じて最新のIT業界動向を学ぶことができた。また、優秀な社員の方や学生と知り合うこともできた。IT業界やベンチャー企業に興味がある人には是非ともおすすめしたいインターンである。"
44,8,"a",43,"2017-05-20 05:59:43","2017-05-20 05:59:43",1,"企画、運営、渉外、広報","6ヶ月〜11ヶ月","週1日未満","無給（交通費なし）",10,5,8,8,10,8,8,"イベント当日に向けた毎月のイベント企画、運営。当日に向けて、広報や作品募集の呼びかけ。企業からの協賛、資金調達等々。JICAや関係者との打ち合わせ。","「学生インターン」という位置づけで、この映像祭のイベントは主に学生主体で動くことであったため、裁量権は非常に大きかった。自ら、主体的に動くことを求められ、分からないところは積極的に聞くことで、より良い方法や道筋を提示してくれた。","社会人や大学の教授、様々な大人と関わる中でのコミュニケーションスキル向上。 映像祭ということで、プレ企画で映像作成のワークショップも行い、そうした映像作成、編集のスキルも学べる。 広報戦略、イベント運営、当日のマネジメント等々、体験的に見つけられることが多い。"," インターン統括になれば、常に代表の方と連絡を密に取り合い、重要な打ち合わせなどにも同席する。日頃から、インターン生のことをよく見てくれ打ち上げの時などに様子をうかがってくれる。","コワーキングスペースでの活動がメインなので、ある意味風通しがよく自由な雰囲気がある。関わり方も、それぞれに合わせてくれるので融通がきく。","世界における国際問題、平和の対極にある戦争や紛争に対してそれに興味関心のある人々と関わり、自身の視野を広げながら深めていきたいと思いインターンをすることにした。実際、多くの大人と関わる中で、新たな繋がりが生まれ、インターン外で紹介してくださった大学教授の授業に参加することができたことなどは非常に大きかった。","普段大学のサークルなどでは、大人と関わることが少ない中、インターンは学生が少数という大人に囲まれた環境に身を置くことで、社会に出る前の心構えのようなものを感じられると考えている。 インターンをすることは、自身の活動範囲を広げ、人との繋がりも増えることから、学生のうちにしかできない貴重な体験の一つであると思う。"
45,9,"a",29,"2017-05-20 08:03:42","2017-05-20 08:03:42",2,"カスタマーサービス","6ヶ月〜11ヶ月","週3日〜4日","1000円〜1099円",8,8,8,8,10,8,9,"・業務内容：企業・業界情報を効率的に分析できるツールSPEEDAのカスタマーサポートチームで、お客様の電話・メール対応やエクセルデータ作成、リサーチ業務に従事。 ・業務の割合：個人による","社員の方と同程度の裁量権が与えられる。どれだけ任されるかは自分次第で、自分の努力でできることが増えれば、その分仕事を引き受けることができる。","・エクセルスキル：最初3週間ほどのトレーニングプログラムがあり、基本的な関数への習熟度が上がる。 ・電話対応：基本的な敬語や対応方法を学ぶことができる。戦略コンサル・投資銀行バンカーからの質問に対応するため、鍛えられる。 ・財務・会計知識：講習があったり、課題図書を与えられたり、業務を遂行する中で自分で覚えたりと、自分の姿勢次第で深い知識を身につけることができる。","カスタマーサポートチームはインターンが多いため、体制が整っている。3週間のトレーニングプログラムののちは、基本的にはOJTとなる。","かなりオープンな雰囲気で働きやすい環境だと思う。社員インターン交えた懇親会や、他部署との交流もある。","事前の面接や、実際に働いているインターン生の話から内容は想像できていたので、ギャップはなかった。自分のモチベーション次第で学びの大きさが変わってくるということは頭に置いておくべき","SPEEDAに詳しくなることはもちろん、財務会計知識、エクセルスキル、正社員から学ぶ組織マネジメント力など、かなり学ぶことが多いと思う。インターン生も優秀で向上心の高い人が多いので、よいつながりができると感じる。"
46,6,"a",44,"2017-05-20 09:04:21","2017-05-20 09:04:21",3,"広報","6ヶ月〜11ヶ月","週3日〜4日","無給（交通費支給）",8,5,8,10,8,10,8,"・業務内容:会員誌（ニュースレター）の作成が主な仕事。ウェブの情報のみによるクイック記事多数、大きな記事も二本手がけ、取材から編集まで行った。また日々の業務として本部からくるニュースの英訳がある。さらに、イラストが得意だったのでキャンペーンのイラストや、カードも作成した。 ・割合:編集 40%、校正20%、ニュースの英訳30%、取材5%、イラスト・キャンペーンカード作成5%",NULL,"・編集スキル:文書をどのように書けば相手に伝わるのか、上司から学ぶことができた。・英語の記事を要約する能力:日々のニュースの英語の他にも、クイック記事を書く際にも英語の記事をたくさん読んだ。そのため、インターン前よりはるかに英文記事の要点を理解できるようになった。","・職場自体の雰囲気は非常によく、他の職員さんにも話しかけやすい。しかし、実際に関わるのは自分の上司がほとんど。・研修などはあまりなかったが、やっていくうちに覚えた。・アムネスティとしてのスタンス・ガイドラインは一番最初にさらっと教えてもらった。",NULL,NULL,"将来、NGOやNPOで働いてみたい人にはとてもオススメ。小さなベンチャーNPOではなく、歴史あるNGOだからこそのメリット・デメリットがよくわかる。ここで終わりにせず、他のNGOやNPOにも関わってみて違いをしっかり知ると自分のキャリアに大きくいかせると思う。"
47,7,"a",45,"2017-05-20 09:04:28","2017-05-20 09:04:28",4,"マーケティング","6ヶ月〜11ヶ月","週5日以上","800円未満",5,4,10,8,10,8,6,"業務内容：会社が行なっているお客様や学生向けのイベントの企画・運営。イベントのアンケート集計とデータ分析。BtoBの案件全般（商談なども含む）。ブライダル用のカタログギフトの管理・運営。在庫の移動や入荷処理。新規ホームページの立ち上げ。商品の検品・梱包。その他日々のお客様対応やダンボール解体などの作業もあり。 割合：イベント企画・運営：30%　BtoB：30%　カタログギフト：15%　検品作業：15%　在庫管理：10% 　その他毎日のタスク",NULL,"・マネジメント力：イベントの運営が多かったので、それに伴うヒト・モノ・カネの運用方法であったり、プロジェクトの達成のために何をすべきか明確に分析できるようになった。 ・徹底力：お客様に直接届く仕事が多かったので、絶対にミスがないように当たり前のことでも何回も自分や上司に確認してもらってから納得のいく形でタスクを進めた。 ・発言力：上司に対しても、自分の意見をはっきりと伝えられるようになった。 ・自分マネジメント力：仕事に溺れることも多かったのですが、自分の中でしっかり仕事に対する基軸を作り、周りに流されることがない自分の働き方のスタイルをつくることができた。","そもそもマーケティングチームが私を含め基本２人体制なので、直属の上司の先輩には本当によく面倒を見ていただいて、何に関しても相談にのってもらうことができました。ほかの社員さんともインターンという壁は感じずに、自分からいけば誰とでも関われることができます。ただ、会社全体でみるとインターンの研修制度はそれほど整っていないので、新入社員や随時入ってくる社員の方の研修に、自分から手をあげて入れさせていただくくらいしか機会がないです。ただ、私はマネタイズについて勉強がしたかったので、マーケティングチームの上司の方にお願いして何回か研修をしていただきました。",NULL,NULL,"途上国でビジネスを行うということについて深く考えさせられました。また、開発の分野で仕事をしたい私にとっては、様々なプレーヤーがいる中でどのような仕事に就きたいか深く考えるきっかけになりました。なによりも本当に社員のかたのバックグラウンドがさまざまで、みなさまの経験を聞くだけで大変刺激になりました。 ただ、時には24時をまわることもあるようなインターンなので、生半可な気持ちで始めると少し大変すぎて後悔するかもしれません。"
48,8,"a",46,"2017-05-20 09:04:32","2017-05-20 09:04:32",1,"マーケティング","6ヶ月〜11ヶ月","週3日〜4日","900円〜999円",8,10,10,8,8,10,8,"いろいろなマーケティングプロジェクトに参加させていただき、ドイツ本社も関わる業務が多いです。80%がプロジェクトに関係ある書類作成や打ち合わせなどが多い。ドイツ本社の方々とやるワークショップもあります。20%はサポーターを手伝う翻訳業務、事務の業務であります。",NULL,"プロジェクトマネジメントスキル: 実際プロジェクトの一部分メンバーになり、業務を管理やフォローするスキルが延びる。 コミュニケーションスキル: 英語と日本語両方使いながら業務ができる","インターンは一人のサポーターが付く。基本的な会社の歴史や、業務の研修をいただき、pcの使い方までする。",NULL,NULL,"インターンも社員見たいに業務ができる。ドイツ本社と関わるチャンスが多い。英語、日本語も生かせる。さらに車業界のことを知ることができる"
